[
  {
    "portfolio_version_id": "00000000-0000-4000-8000-000000000001",
    "base_currency": "USD",
    "cutoff": "2026-09-25T12:00:00Z",
    "positions": [
      {
        "instrument_id": "00000000-0000-4000-8000-000000000010",
        "display_symbol": "EXCO",
        "quantity": "40",
        "cost_basis": "3600.00",
        "price": {
          "value": "101.25",
          "observation_id": "00000000-0000-4000-8000-000000000020",
          "observed_at": "2026-09-24T20:00:00Z",
          "feed": "fixture"
        },
        "market_value": {
          "kind": "calculation",
          "value": "4050.00",
          "basis": "quantity \u00d7 close"
        },
        "unrealized_pl": {
          "kind": "calculation",
          "value": "450.00",
          "basis": "market value \u2212 total cost basis"
        },
        "weight": {
          "kind": "calculation",
          "value": "1.000000",
          "basis": "share of priced value (excludes cash and unpriced positions)"
        }
      },
      {
        "instrument_id": "00000000-0000-4000-8000-000000000011",
        "display_symbol": null,
        "quantity": "10",
        "cost_basis": null,
        "price": null,
        "market_value": {
          "kind": "unavailable",
          "reason": "no_price"
        },
        "unrealized_pl": {
          "kind": "unavailable",
          "reason": "market_value_unavailable"
        },
        "weight": {
          "kind": "unavailable",
          "reason": "market_value_unavailable"
        }
      }
    ],
    "totals": {
      "priced_value": {
        "kind": "calculation",
        "value": "4050.00",
        "basis": "exact sum of available market values, rounded once"
      },
      "cash": {
        "kind": "calculation",
        "value": "1500.00",
        "basis": "supplied USD cash"
      },
      "total_value": {
        "kind": "unavailable",
        "reason": "positions_unpriced"
      }
    },
    "coverage": {
      "positions": 2,
      "priced": 1,
      "unpriced": 1,
      "by_reason": {
        "no_price": 1
      }
    }
  },
  {
    "portfolio_version_id": "00000000-0000-4000-8000-000000000001",
    "base_currency": "USD",
    "cutoff": "2026-09-25T12:00:00Z",
    "positions": [],
    "totals": {
      "priced_value": {
        "kind": "unavailable",
        "reason": "no_priced_value"
      },
      "cash": {
        "kind": "unavailable",
        "reason": "cash_unknown"
      },
      "total_value": {
        "kind": "unavailable",
        "reason": "cash_unknown"
      }
    },
    "coverage": {
      "positions": 0,
      "priced": 0,
      "unpriced": 0,
      "by_reason": {}
    }
  },
  {
    "portfolio_version_id": "00000000-0000-4000-8000-000000000001",
    "base_currency": "USD",
    "cutoff": "2026-09-25T12:00:00Z",
    "positions": [
      {
        "instrument_id": "00000000-0000-4000-8000-000000000010",
        "display_symbol": "EXCO",
        "quantity": "40",
        "cost_basis": "3600.00",
        "price": {
          "value": "101.25",
          "observation_id": "00000000-0000-4000-8000-000000000020",
          "observed_at": "2026-09-24T20:00:00Z",
          "feed": "fixture"
        },
        "market_value": {
          "kind": "calculation",
          "value": "4050.00",
          "basis": "quantity \u00d7 close"
        },
        "unrealized_pl": {
          "kind": "calculation",
          "value": "-125.50",
          "basis": "market value \u2212 total cost basis"
        },
        "weight": {
          "kind": "calculation",
          "value": "1.000000",
          "basis": "share of priced value (excludes cash and unpriced positions)"
        }
      },
      {
        "instrument_id": "00000000-0000-4000-8000-000000000011",
        "display_symbol": null,
        "quantity": "10",
        "cost_basis": null,
        "price": null,
        "market_value": {
          "kind": "unavailable",
          "reason": "no_price"
        },
        "unrealized_pl": {
          "kind": "unavailable",
          "reason": "market_value_unavailable"
        },
        "weight": {
          "kind": "unavailable",
          "reason": "market_value_unavailable"
        }
      }
    ],
    "totals": {
      "priced_value": {
        "kind": "calculation",
        "value": "4050.00",
        "basis": "exact sum of available market values, rounded once"
      },
      "cash": {
        "kind": "calculation",
        "value": "-0.00",
        "basis": "supplied USD cash"
      },
      "total_value": {
        "kind": "unavailable",
        "reason": "positions_unpriced"
      }
    },
    "coverage": {
      "positions": 2,
      "priced": 1,
      "unpriced": 1,
      "by_reason": {
        "no_price": 1
      }
    }
  }
]
